{
  "schemaVersion": 1,
  "registryVersion": "2a3c93e80fc7ccae6fde06a111eb1afb0679765b02e9acafe4f6292caf90a017",
  "definitions": [
    {
      "typeKey": "automation.captureScreen",
      "typeVersion": 1,
      "runtimeKind": "execution",
      "sideEffect": "deviceRead",
      "category": "device",
      "titleKey": "node.automation.captureScreen.title",
      "descriptionKey": "node.automation.captureScreen.description",
      "iconKey": "node.imageRecognition",
      "ports": [
        {
          "portId": "run",
          "direction": "input",
          "portKind": "execution",
          "type": {
            "kind": "exec"
          },
          "labelKey": "node.automation.captureScreen.port.run"
        },
        {
          "portId": "image",
          "direction": "output",
          "portKind": "data",
          "type": {
            "kind": "imageRef"
          },
          "labelKey": "node.automation.captureScreen.port.image"
        },
        {
          "portId": "width",
          "direction": "output",
          "portKind": "data",
          "type": {
            "kind": "number"
          },
          "labelKey": "node.automation.captureScreen.port.width"
        },
        {
          "portId": "height",
          "direction": "output",
          "portKind": "data",
          "type": {
            "kind": "number"
          },
          "labelKey": "node.automation.captureScreen.port.height"
        },
        {
          "portId": "next",
          "direction": "output",
          "portKind": "execution",
          "type": {
            "kind": "exec"
          },
          "labelKey": "node.automation.captureScreen.port.next"
        }
      ],
      "requiredCapabilities": ["automation.captureScreen"]
    },
    {
      "typeKey": "automation.clickPoint",
      "typeVersion": 1,
      "runtimeKind": "execution",
      "sideEffect": "deviceWrite",
      "category": "device",
      "titleKey": "node.automation.clickPoint.title",
      "descriptionKey": "node.automation.clickPoint.description",
      "iconKey": "node.click",
      "ports": [
        {
          "portId": "run",
          "direction": "input",
          "portKind": "execution",
          "type": {
            "kind": "exec"
          },
          "labelKey": "node.automation.clickPoint.port.run"
        },
        {
          "portId": "point",
          "direction": "input",
          "portKind": "data",
          "type": {
            "kind": "point"
          },
          "labelKey": "node.automation.clickPoint.port.point"
        },
        {
          "portId": "image",
          "direction": "input",
          "portKind": "data",
          "type": {
            "kind": "imageRef"
          },
          "labelKey": "node.automation.clickPoint.port.image"
        },
        {
          "portId": "points",
          "direction": "input",
          "portKind": "data",
          "type": {
            "kind": "collection",
            "element": {
              "kind": "point"
            }
          },
          "labelKey": "node.automation.clickPoint.port.points"
        },
        {
          "portId": "rect",
          "direction": "input",
          "portKind": "data",
          "type": {
            "kind": "rect"
          },
          "labelKey": "node.automation.clickPoint.port.rect"
        },
        {
          "portId": "x",
          "direction": "input",
          "portKind": "data",
          "type": {
            "kind": "number"
          },
          "labelKey": "node.automation.clickPoint.port.x",
          "acceptsLiteral": true
        },
        {
          "portId": "y",
          "direction": "input",
          "portKind": "data",
          "type": {
            "kind": "number"
          },
          "labelKey": "node.automation.clickPoint.port.y",
          "acceptsLiteral": true
        },
        {
          "portId": "referenceWidth",
          "direction": "input",
          "portKind": "data",
          "type": {
            "kind": "number"
          },
          "labelKey": "node.automation.clickPoint.port.referenceWidth",
          "acceptsLiteral": true
        },
        {
          "portId": "referenceHeight",
          "direction": "input",
          "portKind": "data",
          "type": {
            "kind": "number"
          },
          "labelKey": "node.automation.clickPoint.port.referenceHeight",
          "acceptsLiteral": true
        },
        {
          "portId": "clicked",
          "direction": "output",
          "portKind": "data",
          "type": {
            "kind": "bool"
          },
          "labelKey": "node.automation.clickPoint.port.clicked"
        },
        {
          "portId": "clickedCount",
          "direction": "output",
          "portKind": "data",
          "type": {
            "kind": "number"
          },
          "labelKey": "node.automation.clickPoint.port.clickedCount"
        },
        {
          "portId": "selectedIndex",
          "direction": "output",
          "portKind": "data",
          "type": {
            "kind": "number"
          },
          "labelKey": "node.automation.clickPoint.port.selectedIndex"
        },
        {
          "portId": "next",
          "direction": "output",
          "portKind": "execution",
          "type": {
            "kind": "exec"
          },
          "labelKey": "node.automation.clickPoint.port.next"
        },
        {
          "portId": "failed",
          "direction": "output",
          "portKind": "execution",
          "type": {
            "kind": "exec"
          },
          "labelKey": "node.automation.clickPoint.port.failed"
        }
      ],
      "propertySchema": {
        "type": "object",
        "additionalProperties": false,
        "required": ["inputMode"],
        "properties": {
          "inputMode": {
            "type": "string",
            "enum": [
              "point",
              "coordinates",
              "randomPoints",
              "sequentialPoints",
              "rectCenter",
              "rectRandom"
            ],
            "x-rinoLabelKey": "node.automation.clickPoint.property.inputMode.label",
            "x-rinoDescriptionKey": "node.automation.clickPoint.property.inputMode.description",
            "x-rinoOptionLabelKeys": {
              "point": "node.automation.clickPoint.property.inputMode.option.point",
              "coordinates": "node.automation.clickPoint.property.inputMode.option.coordinates",
              "randomPoints": "node.automation.clickPoint.property.inputMode.option.randomPoints",
              "sequentialPoints": "node.automation.clickPoint.property.inputMode.option.sequentialPoints",
              "rectCenter": "node.automation.clickPoint.property.inputMode.option.rectCenter",
              "rectRandom": "node.automation.clickPoint.property.inputMode.option.rectRandom"
            }
          },
          "intervalMilliseconds": {
            "type": "integer",
            "minimum": 0,
            "maximum": 60000,
            "x-rinoLabelKey": "node.automation.clickPoint.property.intervalMilliseconds.label",
            "x-rinoDescriptionKey": "node.automation.clickPoint.property.intervalMilliseconds.description"
          }
        }
      },
      "propertyDefaults": {
        "inputMode": "coordinates",
        "intervalMilliseconds": 100
      },
      "requiredCapabilities": ["automation.clickPoint"]
    },
    {
      "typeKey": "automation.clickRectCenter",
      "typeVersion": 1,
      "runtimeKind": "execution",
      "sideEffect": "deviceWrite",
      "category": "device",
      "titleKey": "node.automation.clickRectCenter.title",
      "descriptionKey": "node.automation.clickRectCenter.description",
      "iconKey": "node.click",
      "ports": [
        {
          "portId": "run",
          "direction": "input",
          "portKind": "execution",
          "type": {
            "kind": "exec"
          },
          "labelKey": "node.automation.clickRectCenter.port.run"
        },
        {
          "portId": "rect",
          "direction": "input",
          "portKind": "data",
          "type": {
            "kind": "rect"
          },
          "labelKey": "node.automation.clickRectCenter.port.rect",
          "required": true
        },
        {
          "portId": "offsetX",
          "direction": "input",
          "portKind": "data",
          "type": {
            "kind": "number"
          },
          "labelKey": "node.automation.clickRectCenter.port.offsetX"
        },
        {
          "portId": "offsetY",
          "direction": "input",
          "portKind": "data",
          "type": {
            "kind": "number"
          },
          "labelKey": "node.automation.clickRectCenter.port.offsetY"
        },
        {
          "portId": "offsetWidth",
          "direction": "input",
          "portKind": "data",
          "type": {
            "kind": "number"
          },
          "labelKey": "node.automation.clickRectCenter.port.offsetWidth"
        },
        {
          "portId": "offsetHeight",
          "direction": "input",
          "portKind": "data",
          "type": {
            "kind": "number"
          },
          "labelKey": "node.automation.clickRectCenter.port.offsetHeight"
        },
        {
          "portId": "clicked",
          "direction": "output",
          "portKind": "data",
          "type": {
            "kind": "bool"
          },
          "labelKey": "node.automation.clickRectCenter.port.clicked"
        },
        {
          "portId": "next",
          "direction": "output",
          "portKind": "execution",
          "type": {
            "kind": "exec"
          },
          "labelKey": "node.automation.clickRectCenter.port.next"
        },
        {
          "portId": "failed",
          "direction": "output",
          "portKind": "execution",
          "type": {
            "kind": "exec"
          },